{
  "schemaVersion": "1.1.0",
  "id": "senryou",
  "groupId": "senryou",
  "relationships": [],
  "nameJa": "センリョウ",
  "scientificName": "",
  "aliases": [
    "千両",
    "クササンゴ"
  ],
  "classification": {
    "category": "常緑広葉樹・低木",
    "familyJa": "センリョウ科",
    "familyScientific": "",
    "genusJa": "センリョウ属",
    "genusScientific": "",
    "cultivar": ""
  },
  "basicData": {
    "growthHabit": "生長速度：遅い。日当たり：陰樹。乾湿：湿気を好む。大気汚染：普通。萌芽力：普通。",
    "height": "自然状態：0.5〜1.2m。庭植目安：0.5〜1m。",
    "spread": "自然状態：0.5〜1.5m。庭植目安：0.5〜1m。",
    "deciduousEvergreen": "常緑",
    "notes": [
      "茎の頂部に赤い実をつけ、自然な樹形を楽しむ。",
      "主な病害虫：特になし。",
      "栽培可能地域：関東〜沖縄。",
      "花色：淡黄緑。実色：赤、黄。",
      "千両と万両は縁起木の代表とされ、名前は財産やお金に関係する。"
    ]
  },
  "calendar": {
    "floweringMonths": [
      6,
      7
    ],
    "pruningMonths": [
      2
    ],
    "flowerBudFormationMonths": [
      7,
      8,
      9
    ],
    "harvestMonths": [
      1,
      2,
      11,
      12
    ],
    "plantingMonths": []
  },
  "pruning": {
    "summary": "通常はほとんど剪定せず、枝が込んだ場合に枝透かしを行う。株が大きくなった場合は、2月頃に実をつけた古枝を地際から切り、新しい枝へ更新する。",
    "timing": [
      "新芽が伸びる直前の2月頃に古枝を更新する。",
      "剪定カレンダーでは2月が剪定適期として示されている。"
    ],
    "methods": [
      {
        "name": "古枝の更新",
        "description": "実をつけた古枝を地際から切り、新しい枝を育てる。",
        "conditions": "株が大きくなった場合。",
        "diagramId": "senryou-renewal-reference"
      },
      {
        "name": "中間位置での切り戻し",
        "description": "枝数が少なく寂しい場合は、枝の中間にある葉の上で切り戻す。",
        "conditions": "枝数が少ない場合。",
        "diagramId": "senryou-renewal-reference"
      },
      {
        "name": "切り花としての枝切り",
        "description": "実がついている間に、剪定ばさみで枝をまとめて切る。",
        "conditions": "切り花として利用する場合。",
        "diagramId": ""
      }
    ],
    "warnings": [
      "通常は剪定を必要としないため、枝が込んだ場合に限って枝透かしを行う。"
    ],
    "flowerBudType": "unknown",
    "difficulty": "易しい"
  },
  "diagrams": [
    {
      "id": "senryou-renewal-reference",
      "path": "",
      "type": "source-diagram-description",
      "note": "63ページの剪定図。古枝を地際から切って新しい枝に更新する方法と、枝数が少ない場合に中間の葉の上で切り戻す方法を示す。"
    }
  ],
  "sources": [
    {
      "sourceId": "book-001",
      "page": 63,
      "extractionType": "combined",
      "note": "元画像：Senryou .JPG。本文、基本データ、剪定・開花・花芽分化・結実カレンダー、メモ、剪定図から抽出。"
    }
  ],
  "reviewStatus": "draft",
  "updatedAt": ""
}
